{
    "name": "Dotfiles for Arch Linux",
    "summary": "Dotfiles for Arch Linux container with common tools installed.",
    "contributors": [
        {
            "name": "Bart Venter",
            "link": "https://github.com/bartvener"
        }
    ],
    "definitionType": "Dockerfile",
    "containerHostOSSupport": [
        "Linux",
        "macOS",
        "Windows"
    ],
    "containerOS": {
        "os": "Linux",
        "distribution": "Arch"
    },
    "platforms": [
        "linux/amd64"
    ],
    "languages": [
        "Python",
        "Node.js"
    ]
}